Title_Item,Price,Original Price,description,time_of_published,status
Niche beautiful dress like new,65.0,200.0,Beautiful niche dress has turquoise design on the front and silk belt has been put away like new it says med but it will fit a small exelent condition ❤️,2020-03-04T23:36:54-08:00,available
Aventurg Dress,55.0,0.0,This is a nice dress and comfortable and in excellent condition good for spring,2020-03-16T10:48:30-07:00,available
ModX Dress,60.0,777.0,This dress is ready for spring beautiful colors so light on your body you will get a lot of stairs were in days like new never been worn,2020-03-29T11:00:19-07:00,available
Max Studio Dress,65.0,777.0,max Studio Dress  new Condition,2020-09-07T13:54:33-07:00,available
Michael kors Boots,119.0,777.0,Michael kors Boots new condition only worn once great shape  they will go with anything  really nice 👍,2022-09-27T20:02:12-07:00,available
American Eagle Shoes 👞,60.0,777.0,American Eagle Shoes New never worn really cute they will go with any thing,2021-11-18T15:43:28-08:00,available
Michael kors lite wait jacket,49.0,777.0,Really nice Michael Kors light weight jacket it is missing the belt but otherwise in great condition so comfortable,2020-03-29T10:40:20-07:00,available
Vintage Fur Cape,65.0,0.0,Vintage fur Cape excellent condition I don’t know what kind of Fur it is because it doesn’t say all I know that this is real ❤️,2020-05-10T14:16:01-07:00,available
Riders Levi jacket,35.0,0.0,Riders Levi jacket new condition no tag excellent shape like new❤️,2020-04-21T06:54:13-07:00,available
Express coat,69.0,777.0,Express coat new never worn very lite Waite really nice,2021-08-23T21:47:32-07:00,available
FOREVER 21 Jeans JACKET,62.0,777.0,Forever 21 Jeans Jacket beautiful condition and art Work  I have had this for a while but haven’t worn it  this is a unique jacket.,2021-02-25T22:01:56-08:00,available
SIONI  JACKET,55.0,777.0,SIONI   FAUX FUR JACKET REALLY SOFT  VERY LITE AND CUTE  HAS POCKETS IN THE FRONT PRETTY PINK,2021-08-04T14:43:43-07:00,available
Jacket,65.0,0.0,Wet seal beautiful jacket nice design new,2020-03-01T13:00:03-08:00,available
London jean jacket,75.0,777.0,London jean jacket new Condition  has a nice lining it’s warm and has stretch it’s so cute 🥰,2021-09-15T22:04:20-07:00,available
Beautiful pull over hoodie never worn   Gap,22.0,0.0,Gap Pull over hoodie I have never worn it just been in my closet ready for a new home excellent new condition,2020-04-20T13:12:42-07:00,available
Bebop & Wally jacket,35.0,0.0,Beautiful jacket like new condition has blue Ribbon for the ties.great for this time of the year casual or dresse.,2020-02-29T20:31:52-08:00,available
Christine Alexander jacket,65.0,777.0,Christine Alexander jacket with studs and rhinestones never worn you can dress up are dress down with this beautiful jacket has rhinestones on the pockets and also on the buttons thanks for looking,2020-09-25T11:55:54-07:00,available
579 Levi jacket,25.0,0.0,like new 57 and nine Levi jacket acid wash in new condition it hasn’t been worn excellent shape very comfortable and stretchy🌹,2020-04-22T08:27:27-07:00,available
Disney grey mini jacket,39.0,0.0,"Reposhing this item I purchased from @fizznick70. Loved it, but ready to rotate for something new.

Questions? Leave a comment below!",2021-10-16T17:08:15-07:00,available
A.M.I. Jacket,40.0,0.0,A.M.I. Levi Jacket excellent condition like new only worn a few times great for any time of the year,2020-05-20T12:31:30-07:00,available
Vertigo jacket,55.0,0.0,Never been worn like new wear with jeans are dress eye catcher .,2020-02-29T20:58:57-08:00,available
Gorgeous Sexy Vegan Leopard Fur Coat,88.0,777.0,"Reposhing this item I purchased from @frankie1971. Loved it, but ready to rotate for something new.

Questions? Leave a comment below!",2021-11-17T21:20:27-08:00,available
Ball of cotton sweater,49.0,777.0,Ball of cotton pullover sweater has velvet trim on sleeves and on hoodie really cute and contrable,2020-10-24T18:20:04-07:00,available
Free People cardigan,49.0,777.0,Free People cardigan really soft and comfortable good used condition very nice and warm,2021-02-08T10:37:34-08:00,available
Hart Schaffer & Marx  mens jacket,299.0,400.0,Hart Schaffer & Marx   Jacket vintage new never worn came from the ZCM I  witch hasn’t been around for years Beautiful jacket a man or woman can wear this   This is for large to extra large it’s on the tag thanks for looking .🎅,2022-11-02T12:42:35-07:00,available
Gap Jacket,45.0,777.0,Gap Jacket like new worn a fue Times excellent condition,2020-05-10T15:19:18-07:00,available
HARLEY DAVIDSON LEATHER JACKET🎆🎆🎆🎆,375.0,777.0,HARLEY DAVIDSON LEATHER JACKET  NEW  CONDITION HAS ONE INSIDE POCKET LARGE QUILTED LINNING  TWO POCKETS THAT HAS ZIPPERS AND ZIPPERS ONE THE SLEEVES PLUSS FRINGE BEAUTIFUL JACKET NEW CONDITION WILL KEEP YOU WARM💕💕💕💕💕💕💕💕,2020-12-05T22:10:22-08:00,available
Mishca jacket,65.0,777.0,Mishca jacket really cute great for fall new Condition never worn still has tag ❤️,2020-10-11T21:37:46-07:00,available
Christine Alexander sweater,85.0,777.0,Christine Alexander Beautiful sweater has rinestones on the sleeves and hoodie  never been worn 😊🎁,2022-10-20T23:18:10-07:00,available
Vintage mink coat,599.0,2000.0,Vintage mink and Leather Coat  small to midsize excellent condition no rips the mink is beautiful soft leather has pockets it is a chevron style the lineing feels like satin.,2020-09-15T21:29:02-07:00,available
LEATHER JACKET,375.0,777.0,Vintage leather jacket great shape no rips or stains Leather is in excellent shape  it’s just been hanging in my closet it may need a cleaning but it’s fine the way it is  love all the fringes 🔥🔥,2022-08-11T23:45:29-07:00,available
Michael kors coat,125.0,777.0,Michael kors lite Waite coat  new never worn  Beautiful color like a lime green has beautiful linen snap closure and the hoodie can be removed  really comfortable to wear great find wear any time of the year .❤️👍,2023-02-06T10:53:17-08:00,available
Michael kors  jacket,55.0,777.0,Michael kors jacket only used once new Condition I love the color and the gold zipper,2021-10-12T20:28:45-07:00,available
AMERICAN EAGLE 🦅 JACKET,75.0,777.0,AMERICAN EAGLE 🦅 OUTFITTERS JACKET NEW  NEVER WORN BEAUTIFUL PLAID COLOR NICE AND WARM Jacket,2020-12-11T08:16:55-08:00,available
Free People jump suit,98.0,777.0,Free People jump suit really cute 🥰 the zipper is on the side and it has the flair legs 🦵 never been worn great for the summer .👍,2023-04-19T23:49:35-07:00,available
Versace trench coat authentic new,800.0,5000.0,"Versace New Coat never worn still has tags on it 5,000 new  Beautiful and Authentic very lite  Waite so comfortable to wear great for any time of the year❤️❤️❤️❤️❤️❤️",2021-10-08T18:41:37-07:00,available
Sam Edelman trench Coat,98.0,777.0,Sam Edelman Designers trench Coat Beautiful lots  of details Brand new without tags really a nice color for any time of the year fully lined .😊,2020-08-19T12:17:18-07:00,available
Lucky ☮️ tee shirt,20.0,0.0,Nice T-shirt I’ll hand stitch very good condition nice for spring or summer☮️,2020-03-21T18:27:38-07:00,available
Isabel Flory boots,180.0,777.0,Isabel Flory boots good used condition is very unique made in Italy really a eyecatcher they are easy to put on has zipper on the  side about a four inc heal  really cute but made well  .,2023-03-16T12:49:59-07:00,available
Dr. Martens Boots,175.0,777.0,Dr. Martens Air Wair  Boots with Bouncing  soles  new never worn  they run small I wear a eight  and they fit smug so I would say about a seven to a seven and one half to make sure and in kids about a six  👍,2022-06-16T11:02:29-07:00,available
Donald j plainer  shoes,35.0,777.0,Donald J PLinerLeather shoes really comfortable,2021-08-15T14:55:17-07:00,available
Vince camuto shoes,75.0,777.0,Vince camuto  shoes leather  Beautiful shoes only worn once  they were to high for me but very nice looking,2021-04-14T16:13:47-07:00,available
Timberland 🥾 Boots,110.0,777.0,Timberland Suede and leather trim boots great condition just tried them on  new  really Contrable  and cute,2021-07-28T13:06:59-07:00,available
Double -H  Shoes,125.0,777.0,Double- H Leather Shoes New Never Worn Beautiful Design  Hand Made In Mexico Really Contrable,2021-08-29T19:54:14-07:00,available
Rag & Bone Boots,95.0,777.0,Rag & Bone Boots good used condition all Leather  very contrable 👍,2022-08-17T10:49:55-07:00,available
B MAKOWSKY SHOES,90.0,777.0,B MAKOWSKY SHOES NEW WITH OUT TAGS  LEaTHER WITH STUDS,2021-03-17T23:49:52-07:00,available
Michael Kors bracelet watch,59.0,777.0,Michael Kors bracelet watch new really nice gold tone Don’t have the Box but will send package nice  thanks for looking,2021-06-14T00:32:18-07:00,available
ITALIAN SHOE MAKERS SANDELS,49.0,777.0,ITALIAN SHOE MAKERS  NEW  m a d e iN  ITALY,2021-06-25T15:10:17-07:00,available
Madewell  👞 shoes,85.0,777.0,Madewell  shoes new never worn Real calf fur  really good pair of shoes,2021-08-18T20:53:41-07:00,available
Vince Comodo suede leather shoes,65.0,777.0,Vans Comodo suede leather shoes very nice condition only used a few times Siri comfortable,2021-08-04T12:34:59-07:00,available
Donald j PLiner Boots,98.0,777.0,Donald j PLiner Leather Boots new never worn   Great pair of Boots you can wear with most anything 🥾,2022-01-07T11:31:27-08:00,available
Jones New York high heeled shoes,45.0,777.0,Jones New York heeled shoes new never worn really nice great for any time of the year,2021-08-04T12:04:43-07:00,sold_out
CONVERSE SHOES,40.0,777.0,CONVERSE SHOES  👞 NEW Never WORN  FIT A MAN ARE WOMEN THEY Are REALLY NICE 🇺🇸,2020-07-01T11:09:52-07:00,available
Rag & Bone combat boots,189.0,777.0,Rag & Bone combat boots Leather new never worn  has a little scuff on one side of the shoe but not noticeable  it says on the size 37 but I would say about a 8 1/2 ore nine  really nice looking Boots and made well  😊,2023-01-07T18:42:09-08:00,available
REEBOX MENS SHOES,60.0,777.0,REEBOK  SHOES NEW    NEVER WORN HAS A LOT Of CUSHION,2022-11-02T22:40:13-07:00,available
Coach sneakers,55.0,777.0,Coach sneakers new never worn just to try and very comfortable really stylish,2021-08-04T12:45:27-07:00,available
Coach 👠,49.0,0.0,Coach 👠 nice Condition used a few times but otherwise good shape,2020-05-26T17:24:11-07:00,available
Frye Boots,104.0,777.0,Frye Boots 🥾 used a fue times good condition very  nice the zipper works great and they are made to last a long time . They are leather.,2020-12-09T11:05:16-08:00,available
DOONEY & BOURKE PURCE,125.0,777.0,DOONEY & BOURKE PURCE new never used crossbody are shoulder two zippers in the front that works  great For all your  necessities,2022-08-05T22:41:25-07:00,available
Play boy bag,250.0,800.0,One of a kind it came from the play boy mansion 19inc with 15inc Deep  large bag can use for a overnight are Computer bag thanks for your interest,2020-02-17T17:02:54-08:00,available
PAIGE JEANS SKYLINE,63.0,777.0,PAIGE  SKYLINE JEANS  EXCELLENT CONDITION VERY  LITE WAITE HAS STRETCH.,2021-03-10T13:14:06-08:00,available
Kate ♠️ Spade Purce,80.0,0.0,Kate Spade ♠️  New Condition Never Used 7 inches in width 7 inches in length shoulder drop strap 20 inches beautiful bag,2020-06-03T14:45:27-07:00,available
M.C jeans,25.0,98.0,They are Michael Kors Jeans excellent used condition has a lot of stretch to them so they are comfortable still have a lot of life to them  taking offers❤️,2020-02-19T21:20:28-08:00,available
Marc By Marc Jacobs purce,225.0,999.0,Beautiful tan leather two way bag like new condition never used very light to Carrie great for spring or any time of the year,2020-05-15T22:32:18-07:00,available
Michael kors tote,199.0,777.0,Michael kors Large Canvas Leather tote Never Used  New Condition Really A Nice Bag Has One Zippier Compartment on  the inside plus Four Others 🇺🇸,2020-07-04T08:52:05-07:00,available
Nicole Lee Bag,99.0,110.0,Nicole Lee  USA Bag new Never used beautiful design has lots of compartment  10 inc across and ten deep plus’s shoulder strap witch is adjustable really unique bag lots of work to the bag comes with extra stones incase you loose one ❤️,2021-01-14T15:29:05-08:00,available
Michael kors Bag,198.0,777.0,Beautiful all leather like new condition the leather is very good no marks no tears all original great fall,2020-05-02T15:16:21-07:00,available
Michael kors Bag,250.0,777.0,Beautiful all leather Michael Kors large shoulder bag new condition never used no rips or tears are stains smells like new great for any time of the year lots of room,2020-06-17T13:50:56-07:00,available
Coach Leather Bag,159.0,777.0,Coach leather Two way Bag new Condition inside and out has  one zipper compartment on the inside plus a place for your cell phone and one other  never used comes with dust bag and the color is a kind of a orangey pinkish Red thanks for looking.,2020-08-20T22:19:13-07:00,available
Marc by Marc Jacobs Bag,175.0,777.0,Marc by Marc Jacobs Lamb and Leather Bag has drop strap are you can carry it beautiful color and so soft leather has been taken good care of,2020-11-28T10:42:09-08:00,available
Michael kors Bag,225.0,777.0,Michael kors large Leather Bag nice used condition no stains are smell very clean not used very much really nice .,2021-05-10T16:34:01-07:00,available
Dooney & Bourke,65.0,777.0,Dooney & Bourke  small Bag all Leather new Condition  big enough to carry small  items,2021-07-14T21:44:56-07:00,available
Coach Bag,49.0,300.0,Coach sling Bag  Leather Beautiful detail,2020-10-23T14:27:49-07:00,available
Michael Kors Purce,120.0,0.0,Beautiful Michael Kors never been used shoulder bag 9 inches in width by 7 inches long 22 inches shoulder drop magnetic closure three compartments in the bag great for any time of the year🦅,2020-06-03T14:58:06-07:00,available
Michael kors Bag,85.0,777.0,Michael kors Bag good used condition the inside of the bag is like new it has a zipper compartment plus another one a place for your phone the leather is in great shape except we’re I posted on the corners  and the studs on the bottom of the bag has some tarnish but not notable all along there is still a lot of life in this bag also has a hook for keys priced to sell.,2021-07-19T14:15:25-07:00,available
Michael kors  Bag,149.0,777.0,Michael kors Beautiful Bag really pretty color for summer or any time of the year excellent condition has side pockets one zipper compartment  Plusfor other small compartments⭐️⭐️⭐️⭐️,2020-06-14T12:49:45-07:00,available
Michael kors Bag,249.0,1000.0,Michael kors Beautiful Leather Bag  New Never used it has four compartment on the inside and one in the front and one in the back they are snap closers really a nice bag no one has ever used it it’s Beautiful is side and out💋,2020-07-22T01:20:46-07:00,available
Dooney and Brouke,98.0,777.0,Beautiful Dooney & Bourke Large Bag Comes With Two Wallet  Never Been used has A Zipper. Compartment on the Back And One Inside Plus a Place For Your Phone Nice Large Bag ❤️,2020-04-01T13:20:23-07:00,available
Marc Jacobs Leather Bag,198.0,777.0,Marc Jacobs Leather quilted Hand Bag used condition but still Beautiful has some ware on the handle  the inside is clean  and it’s large the zipper works great and no smell the bag has been put away  you can still get a lot of use out of this Marc Jacobs thanks for looking .,2020-12-14T22:34:53-08:00,available
Marc by Marc Jacobs  Leather Bag,98.0,777.0,Marc by Marc Jacobs Leather Bag really a nice bag has a little ware on the corner witch you can’t tell but I wanted to point that out and a little Scuf on the zipper pull witch I pointed out not noticeable nine and one half across seven inches deep shoulder strap drop twenty two inc  beautiful calf Leather really a nice bag has large front pocket thanks for looking ☮️,2021-01-17T09:05:18-08:00,available
Coach Bag,190.0,777.0,Coach Bag beautiful leather has satin lined has three compartment on the enside nice used bag but looks new on the inside ther is no rips or stains on the leather nice bag,2021-04-29T14:21:34-07:00,available
Coach Bag,120.0,168.0,Coach Leather small Bag new has one compartment on the inside and another one on the front of the Bag witch is big enough for your cell phone it’s really nice .,2021-06-07T11:15:38-07:00,available
Kate Spade  purce,25.0,777.0,Kate Spade little purce nice and shiny great for your credit cards and other small things the color is really pretty . New.,2023-03-23T08:27:26-07:00,available
Michael kors beautiful Dress,55.0,250.0,Nice like new never wore,2020-03-04T18:14:34-08:00,available
Michael kors Dress,65.0,777.0,Michael kors Dress new never been worn has a lot of Stritch to the Dress very comfortable has two zippers on the bottom of the dress and two zippers on the shoulder very cute and unique🦅🦅🤘,2020-06-18T22:46:25-07:00,available
Michael kors Dress,75.0,99.0,Michael kors Dress New really nice it has stretch and very contrable great for a night out on the town,2021-09-28T20:16:12-07:00,available
Zara Dress,85.0,777.0,Zara Form fitted dress this showes off your shape really cute and the color is so pretty  and it’s new has lots of spandex in the material  .,2023-03-16T14:15:49-07:00,available
Romeo  & Juliet Dress,35.0,0.0,Romeo & Juliet Dress new Condition,2020-07-23T07:46:18-07:00,available
DR 2 Dress,50.0,777.0,This is beautiful you can wear as a dress or with pants or leggings it’s higher in  the front then the back has splits on the side nice looking new condition never worn❤️,2020-03-29T11:12:56-07:00,available
DA V I N C I  GOWN,350.0,777.0,Beautiful new DA. VINCI  DRESS you can wear it strapless are with out  designers💋,2022-06-10T00:33:57-07:00,available
EVOVORRO DRESS,75.0,777.0,EVOVORRO   DRESS really comfortable Nice for any time of the year🌹🌹🌹🌹🌹,2020-04-18T12:31:46-07:00,available
Haute  monde set,65.0,777.0,Haute monde  two piece skirt and top  really cute has a adjustable strap and a padded bra for the top. It has snaps on the skirt. It is in great used condition no rips or stains 💥💥💥💥,2023-04-01T10:44:17-07:00,available
H&M’s Dress,59.0,777.0,Beautiful H&M’s dress very unique so different it’s very light the material never been worn💋,2020-06-18T23:05:39-07:00,available
Liberty Love Dress,50.0,777.0,Beautiful liberty love dress beautiful colors ready for spring grab this one never worn❤️,2020-03-29T10:11:50-07:00,available
NINA DRESS From Paris,45.0,777.0,Beautiful sexy dress from Paris cut out around the waist and the sleeves and the bottom great condition just been hanging in my closet hardly worn❤️❤️❤️❤️,2020-04-18T12:00:38-07:00,available
Dress,29.0,0.0,Beautiful colors in this dress never worn ❤️,2020-03-01T12:45:17-08:00,available
HALOGEN DRESS,59.0,118.0,HALOGEN BEAUTIFUL DRESS NEW THE   MATERIAL IS  REALLY SOFT ON YOUR SKIN REALLY DRESSY.,2020-07-07T23:24:49-07:00,available
Love Fire Dress,25.0,0.0,Love Fire Dress wore it once like new condition ❤️,2020-04-13T17:26:45-07:00,available
Bebe Dress,55.0,777.0,Bebe Dress new condition just been hanging in my closet beautiful mini dress very comfortable,2020-11-09T12:19:54-08:00,available
Bongo Dress,45.0,0.0,This dress is so nice I have never worn it it’s just been hanging in my closet trying to down size .it has spandex and very comfortable❤️,2020-03-16T11:24:37-07:00,available
Artelier beautiful Dress,55.0,999.0,This dress is so comfortable to wear shows your shape off great for spring 😊,2020-03-08T17:29:47-07:00,available
Dress,35.0,0.0,Nice print dress like new  great for everyday wear,2020-03-01T11:41:06-08:00,available
MODA INTL  DRESS,35.0,777.0,MODA DRESS nice for the holidays backless very contrable used condition  but no flaws,2020-12-17T11:26:15-08:00,available
Mi  Manch Dress,35.0,0.0,Mi manch Dress good condition no stains no whip vintage dress,2020-10-24T12:50:42-07:00,available
FRENZE DRESS,99.0,777.0,FRENZE DRESS BEAUTIFUL AND SEXIE VERY SHEER HAS  A BRAW FOR SUPPORT  AND   PRETTY  LACE DESIGN,2020-10-15T11:30:18-07:00,available
Dress,65.0,195.0,Beautiful pink dress new never worn great party dress are casual ❤️,2020-03-04T18:01:45-08:00,available
OSOS Dress,49.0,777.0,OSOS DRESS New Never Worn Has Stretch Really Contrable to Wear Really Cute,2020-06-24T11:44:03-07:00,available
EXPO Dress,55.0,999.0,It’s one of a kind beautiful stones around the neck and has a side zipper  very comfortable❤️,2020-03-16T12:52:46-07:00,available
MSK Dress,50.0,999.0,Beautiful has glitter all over the Dress the sleeves are very pretty And it stretches💕,2020-03-16T12:32:00-07:00,available
Little Black Sequin dress,25.0,0.0,This little dress comes with no tag very old vintage in excellent shape no tears or rips all the sequins are their beautiful dress❤️❤️❤️❤️❤️❤️,2020-04-20T12:54:54-07:00,available
This Beautiful Dress Xhilaration,35.0,0.0,Never worn new condition,2020-04-20T13:50:04-07:00,available
Zara Dress,55.0,777.0,Zara Dress new Condition has a split on the back has lots of stretch on the top has zipper on the side  nice dress can wear off the shoulder 💋,2020-07-23T18:53:17-07:00,available
LiGALi Dress,89.0,777.0,LiGALi Dress has tag never worn it has a lot of stretch and moves with your body Beautiful design with stones and mesh sleeves thanks for looking .,2020-10-24T13:14:32-07:00,available
Say What Dress,25.0,0.0,Say What Dress Beautiful Indian design really comfortable❤️,2020-04-02T18:51:02-07:00,available
Flutter & squeak Dress,78.0,777.0,Flutter & squeak Dress never worn new condition really cute with large pockets on the side and the sleeves are gathered it’s different thanks for looking 👀,2020-09-01T23:06:56-07:00,available
Zara Dress,75.0,777.0,Zara Dress Beautiful New never worn lace sleeves and top has back zipper so soft on your skin great for the holidays very dressy.,2020-11-24T22:03:14-08:00,available
Cynthia Rowley Dress,78.0,777.0,Cynthia Rowley Dress never worn really nice for the winter  and very stylish,2020-11-24T21:47:46-08:00,available
Chaudry k c Skirt,45.0,777.0,Chaudry Skirt very full great for fall has side zipper very contrable made in India 🇮🇳,2020-09-07T13:00:03-07:00,available
Inazik skirt,25.0,777.0,Inazik skirt good used condition no flaws,2022-05-18T13:28:04-07:00,available
White House  Black Market Sequin skirt,60.0,777.0,This is a brand new White House Black market sequin skirt very beautiful new never worn great for the holidays thanks for looking,2021-11-18T11:05:14-08:00,available
No name skirt,25.0,0.0,Beautiful skirt witch has no name are size it has a lot of stretch to the waist in excellent condition never worn beautiful  design .it feels like Chiffon are satin,2020-11-12T07:45:04-08:00,available
Roommates Skirt,65.0,0.0,Beautiful sequin design on the front of the skirt hi low like new condition never worn.,2020-03-19T22:31:14-07:00,available
Sarah  Arizona Skirt,65.0,999.0,This skirt is really unique by the way it is made its beautiful ❤️,2020-03-19T22:13:49-07:00,available
F A N C  SKIRT,95.0,777.0,F A N C  S K I R T  Beautiful  work has side  zipper really a eye 👁 catcher can be worn anytime of the year new Condition has not been used thanks for looking.,2020-09-07T12:47:23-07:00,available
Newportnews Leather skirt,99.0,777.0,Newportnews Leather Skirt new Condition only worn a fue times great for the fall are winter .,2020-09-07T12:18:53-07:00,available
Denim BLVD SKIRT,25.0,777.0,DENIM B LVD LEVIE  SKIRT good used condition,2021-10-03T13:34:58-07:00,available
Forever 21 skirt,25.0,75.0,Forever21 skirt nice used condition really cute,2021-02-19T14:23:21-08:00,available
"Chadwick,s Skirt",78.0,777.0,"Chadwick,sSkirt new never worn Beautiful Colors goes with anything.",2020-09-07T13:32:11-07:00,available
Chico’s Suede and leather skirts,85.0,777.0,Chicos suede and leather skirt new condition beautiful with studs really a  eye cachet  great for the fall,2020-08-22T10:30:13-07:00,available
American Eagle Skirt,30.0,777.0,American Eagle  skirt good used condition only been worn a fue times,2021-08-29T14:52:59-07:00,available
American Eagle 🦅 outfitters skirt,30.0,777.0,American Eagle 🦅 outfitters skirt nice used condition,2021-02-19T14:34:57-08:00,available
Cupid Skirt,75.0,777.0,Cupid Skirt new Condition has sequins through the skirt Beautiful .,2020-10-24T22:29:50-07:00,available
Tina Haven Black sequined skirt,55.0,0.0,This skirt is in new condition never worn has a zipper on the side Beautiful🌹,2020-03-16T11:13:11-07:00,available
ANNVA SKIRT,69.0,777.0,ANNVA SKIRT Beautiful Soft Material has Back Zipper  so Shiny Vintage great condition like new.,2020-10-24T22:42:28-07:00,available
For the REPUBLIC Skirt,65.0,777.0,For The Republic skirt  like new condition very nice,2020-09-02T13:22:11-07:00,available
D I M R I SKIRT,60.0,0.0,D I M R I S K I R T  V I N T A G E has rhinestones around the waist really good shape hardly worn just been hanging in my closet,2020-10-24T13:01:38-07:00,available
Leather skirt,65.0,777.0,Nordstrom Leather Skirt Really Soft  and Nice lining zips up the back great for this time of year 👍,2021-10-08T22:00:43-07:00,available
Forever 21 skirt,15.0,0.0,Forever 21 skirt good used condition,2021-02-25T22:38:11-08:00,available
Wet Seal Skirt,125.0,777.0,Wet Seal skirt made in India Beautiful Bead work new Condition never worn thanks for looking 👀,2020-09-02T13:09:18-07:00,available
URBAN Outfitters Skirt,55.0,69.0,URBAN Outfitters Skirt new never used snake 🐍 skin print  really cute great to wear with leggings,2021-09-29T13:02:28-07:00,available
India Skirt,75.0,777.0,India skirt Beautiful vintage excellent condition free size,2021-01-17T12:14:19-08:00,available
