Title_Item,Price,Original Price,description,time_of_published,status
t bags Los Angeles skirt,75.0,777.0,t bags Los Angeles skirt new condition with studs on both sids  and a split in the back very contrable has a lot of stretch thanks for looking 👀,2020-09-02T18:02:13-07:00,available
element skirt,20.0,777.0,element Skirt good used condition really cute and nice for this time of the year has studs and back zipper with a slit in the back .,2021-04-11T12:05:06-07:00,available
Max’s studio special Edition Skirt,45.0,777.0,Max studio special Edition vintage new condition pure silk Beautiful,2021-01-17T12:24:55-08:00,available
CoLLections JS,80.0,999.0,Beautiful suit designers  it has a split on the side of the skirt see thrue sleeves  Beautiful material one of a kind it’s all lined don’t miss out on this one,2020-03-16T12:13:41-07:00,available
Michael kors Blouse,35.0,69.0,Michael kors Blouse new still has tag it has stretch and really cute👌,2021-04-15T13:22:15-07:00,available
RaLph LauRen Skirt,75.0,777.0,Lauren Ralph Lauren silk  skirt new Condition never worn great colors fall are summer 😊,2020-09-02T12:58:00-07:00,available
Banana Republic Dress,65.0,777.0,Banana Republic Dress New condition really cute only worn a fue times true to size .,2021-05-28T13:02:25-07:00,available
American Eagle 🦅 Skirt,15.0,65.0,American Eagle 🦅 Skirt good used condition no flaws,2021-10-08T21:52:21-07:00,available
TED BAKER,75.0,777.0,TED BAKER DRESS All the front is done in sequence very pretty And comfortable,2020-10-24T23:17:04-07:00,available
Gap  Dress,35.0,777.0,Gap Dress 👗 green floral color great used condition only worn once really 🥰 cute,2022-06-22T22:27:28-07:00,available
"ALTAR,D STATE DRESS",59.0,777.0,"ALTAR,D STATE DRESS NEW NEVER WORN BEAUTIFUL AND SHEER 👍",2020-07-14T20:36:43-07:00,available
Auangar shirt,75.0,777.0,Beautiful long sleeve shirt with beaded beads and beautiful design all over the shirt very comfortable it has some stretch to it,2020-03-29T10:28:38-07:00,available
Copelli SANDLES,20.0,777.0,Copelli SANDLES  never worn  but has a little flaw on the strap  witch I pointed out,2021-06-16T14:54:03-07:00,available
Jeweled Vintage Chico  bag,99.0,777.0,Very Beautiful  jeweled  Bag all the stones are there the bag is like new has fringes tassel  beautiful satin lined teas string for closure  great for a night out you will get lots of stares 😊,2021-11-18T15:59:52-08:00,available
Miss me jeans,125.0,777.0,Miss me jeans new condition beautiful design sequins and rhinestones really sparkly easy Boot cut these jeans will make a statement so cute.,2021-03-28T00:11:36-07:00,available
Sam Edelman Shoes,75.0,777.0,Sam Edelman Shoes never worn only just to try on really cute great pair of sandals 👡,2021-06-16T14:45:11-07:00,available
Massimo wedgies,40.0,777.0,Massimo wedges new never worn very cute and stylish,2021-08-04T12:21:00-07:00,available
Vince camuto SANDLES,68.0,777.0,Vince camuto SANDLES new never worn comes with box they lace up your leg real cute,2021-09-19T10:06:13-07:00,available
ED HARDY  SHOES,75.0,777.0,ED HARDY SHOES  NEW  CONDITION ONLY WORN AROUND THE HOUSE  A FUE TIMES REALLY CUTE AND CONTRABLE  😊❤️,2023-01-17T07:49:31-08:00,sold_out
Wool Bennie,35.0,777.0,"Wool Bennie really cute and keeps your head warm there is a name for this hat but I can think about it right at this moment  nice used condition 
It picks up lint on the inside  I guess because it’s wool  thanks for looking 😊",2023-01-17T08:15:36-08:00,available
Harry Potter Bennie,25.0,777.0,Harry Potter Beanie new without tags  really cute,2021-02-08T11:20:41-08:00,available
Angora fur benni,75.0,777.0,Rabbit and Angora fur Bennie  like new really soft and comfortable to wear like new,2021-12-27T11:33:51-08:00,available
COPY - Bebe Blouse,20.0,777.0,Bebe Blouse new never worn feels like satin beautiful the belt to the blouse has separated I don’t know if it came that way are what this  does not effect the belt just wanted to point this out thank you 😊,2023-04-12T10:17:52-07:00,available
ST. JOHN’ S BAY LEATHER BOOTS,50.0,777.0,"ST,JOHNS BAY LEATHER BOOTS NEW NEVER WORN  VERY CONTRABLE HAS STRETCH AROUND THE TOP ❤️",2020-07-12T13:12:19-07:00,available
ITALINA SANDLES,40.0,777.0,ITALINA  sandals NEW Never Worn has pearls and rhinestones and Lace And they Are comfortable really cute,2020-07-09T11:34:20-07:00,available
Blossom shoes,45.0,777.0,Blossom shoes only worn once condition very comfortable really an eyecatcher,2020-07-09T16:28:22-07:00,available
TOMS SHOES,40.0,777.0,TOMS SHOES 👠 NEW NEVER  WORN BEAUTIFUL THEY SHINE ❤️,2020-07-09T11:43:40-07:00,available
MOSSIMO SHOES,49.0,777.0,MOSSIMO SHOES 👞 NEW Never WORN really comfortable have beautiful detail👍,2020-07-09T11:55:58-07:00,available
ITALIAN SHOES,75.0,777.0,ITALIAN SHOES 👠 MAKERS NEW NEVER WORN BEAUTIFUL RED THEY LOOK  LIKE SATIN,2021-04-14T15:48:18-07:00,available
Womens Laredo boots,65.0,50.0,"Reposhing this item I purchased from @shawndabbays. Loved it, but ready to rotate for something new.

Questions? Leave a comment below!",2021-08-26T15:04:48-07:00,available
Columbia Boots,73.0,777.0,Columbia Boots like new Condition suede leatheronly worn a few times sooo contrable.,2022-08-17T11:01:09-07:00,available
UGG Australia Rainier 5189 LIMITED EDITION Beaded,98.0,777.0,Reposhing this item I purchased from @aminabenzarti. Loved them but the wrong size for me they are a great pair of boots 🥾 will keep your feet warm  .,2022-12-09T15:24:54-08:00,available
Bebe shoes,65.0,777.0,Bebe  shoes worn once  to high for me like new,2021-03-18T00:02:01-07:00,available
"Naughty Monkey gold leather shoes, 8m",45.0,65.0,"Reposhing this item I purchased from @divine_byrdie. Loved it, but ready to rotate for something new.

Questions? Leave a comment below!",2021-08-06T10:07:39-07:00,available
Saladore ferragamo shoes,65.0,777.0,Salvador ferragamo shoes good used condition they say 8 but they fit more like a 61/half to seven very narrow for small feet thanks for looking.,2021-01-22T17:09:25-08:00,available
BrikenStock Arizona Bs Women Sandals,55.0,140.0,"Reposhing this item I purchased from @esat. Loved it, but ready to rotate for something new.

Questions? Leave a comment below!Brand new but to small for my grand daughter  and does not come with box .",2021-12-18T10:37:27-08:00,available
Vince Camuto Signature 👢,169.0,1000.0,Vince Camuto Beautiful New Boots never worn still in Box Size runs small but they are a size7/m34 but will fit 6 all Leather,2020-06-18T07:56:34-07:00,available
Rauren  Ralph Lauren sweater,55.0,777.0,Ralph Lauren Sweater  beautiful used condition  it’s really a eye catcher  so soft and contrable  you can wear with jeans or skirt  duo cute,2021-11-18T12:27:25-08:00,available
J CREW SKIRT,39.0,777.0,J CREW SKIRT Like new shape,2021-02-25T22:30:54-08:00,available
J Crew top,40.0,0.0,J Crew Shirt like new  beaded work on the front of the top very stretchy and comfortable❤️,2020-04-08T18:38:41-07:00,available
Atouchofstyle bag,55.0,180.0,New never been used beautiful stud and rhinestones is the bag and Handel it’s really a eye cachet cross body are shoulder❤️,2020-02-21T14:05:59-08:00,available
Leather crossbody Bag vintage,175.0,777.0,Leather crossbody Bag vintage new never used Beautiful colors  great for this time of the year  are for a Christmas gift 💝 gift 🎁,2022-11-02T12:59:10-07:00,available
Tommy HiLFIGER Bag,40.0,777.0,TOMMY HILFIGER  BAG WITH Ajustable  strap new condition great for every day wear very lite Waite really nice 👍,2022-10-20T23:33:12-07:00,available
Kathy purce,98.0,777.0,Kathy purce new never used Beautiful has two zipper  on the side of the bag plus a small compartment in the front one zipper inside plus a small compartment also small but will carry all your idems great for you are a Christmas gift 🎁,2022-10-20T13:43:38-07:00,available
Max Mayer clutch  bag,85.0,200.0,Max Mayer clutch bag very unique has  rhinestones and small beards nice for evening ware  you can wear on your shoulder are carry it 👍,2021-01-06T22:19:40-08:00,available
Phone Bag,23.0,65.0,Phone Bag  this is really nice to carry your phone in  this is in new condition,2021-12-10T12:32:16-08:00,available
Donald j Pliner purce,319.0,777.0,Donald j pliner purce  new Condition only used a fue times beautiful large tote bag satin lining will hold everything draw string closer with magnetic snap pattern leather with leather strap must have bag 💼,2021-03-17T11:39:30-07:00,available
Motif 56  Rock Bag,325.0,777.0,Motif 56 shoulder bag new never used it was made in morocco find flexible leather taned with Samar goat skin  Rock Bag it’s Beautiful 😻 got to have this one .,2021-12-05T11:41:27-08:00,available
Louis Vuitton  Paris Wallet,150.0,600.0,"Reposhing this item I purchased from @namastetrini. Loved it, but ready to rotate for something new.

Questions? Leave a comment below!",2021-10-06T10:57:50-07:00,available
Roxberry Snake skin and Leather Bag,298.0,777.0,Roxberry Snake Skin And Leather  Bag New without tags  very elegant if you want to make a statement this is the Bag it comes with two straps 12 inc deep and 15 inc across an the strap is Adjustable the way it is now is 16 1/2 inches long plus you have your handles you can either carry it or use it for a cross body very shiny and beautiful Louis Vuitton makes this bag high quality.,2020-12-10T08:27:40-08:00,available
Vince Camino Beautiful Bag,225.0,1000.0,Vince Camuto  Leather shoulder bag beautiful has a lot of zippers and compartments in the bag brand new never used don’t miss out on this one❤️,2020-03-07T13:05:02-08:00,available
American Eagle 🦅 Skirt,23.0,777.0,American Eagle 🦅 Skirt Good Used Condition Super Cute,2021-10-08T22:15:51-07:00,sold_out
Bebe Blouse,36.0,777.0,Bebe Blouse new never worn feels like satin beautiful 😻 great for the holidays,2021-11-18T12:07:34-08:00,sold_out
L.A. IDOL Jeans,55.0,125.0,L .A IDOL Jeans good used condition very contrable  all the studs are there really nice looking.,2021-10-08T21:41:27-07:00,available
Aldo Bag,73.0,777.0,Aldo Bag in good condition no rips are stains no smell the inside and outside are great snap closer zipper is excellent lots of room for all your necessities,2020-07-26T01:13:25-07:00,available
Bebe crossbody purce,50.0,69.0,bebe crossbody new never used small but will hold your cell phone and other items really cute,2022-06-02T12:17:54-07:00,available
B C B G Generation Bag,250.0,777.0,BCBG Leather And Snake 🐍 Skin Bag  Beautiful has a lot of room has two zipper compartment it’s hardly been used like new inside and out .,2021-02-26T15:01:15-08:00,available
Chloe hand bag,250.0,777.0,Chloe hand bag new  missing the lock  beautiful leather and color olive green very soft leather it has three compartment for your items   No one has ever used this it stays shut without the lock it got lost some were but still a beautiful bag   Thanks for looking,2021-08-15T12:58:33-07:00,available
Michael kors Bag,78.0,777.0,Michael kors Bag new Condition Leather trim  beautiful soft bag 💼,2021-01-22T11:59:14-08:00,available
N.y.C bag,45.0,0.0,N.y.C nice bag don’t know if it’s leather but it smells like it has one zipper compartment on the in side and two other and the back has a zipper compartment also  it’s in excellent condition .❤️,2020-02-22T11:46:56-08:00,available
Kipling Bag,63.0,777.0,Kipling Shoulder Bag new Condition never used has adjustable straps front zipper pocket very nice bag very soft  small but with fit a lot because of the two compartment,2021-02-19T15:18:00-08:00,available
L’ incontro Leather Bag,199.0,777.0,L’incontro Leather Bag so soft it was made in Italy 🇮🇹 Beautiful New Condition has to straps and you can wear with any outfit shoulder are carry it’s a midsize bag that will carry your items  thanks for looking.,2021-04-08T12:23:22-07:00,available
Bag,30.0,777.0,Bag great for your phone and credit cards 💳 used but in great condition has a small mark on the front of the bag but not noticeable  I can’t tell for sure if this is Atlantic because it don’t have the Logo inside but I just wanted to point this out   Thanks for looking.,2021-12-10T12:46:00-08:00,available
Michael kors Bag,89.0,777.0,Michael kors Canvas leather tote bag large never been used excellent new condition lots of room in this beautiful bag,2020-06-17T14:11:33-07:00,available
Cute saddle leather hand bag,120.0,0.0,"Reposhing this item I purchased from @gtlcloset. Loved it, but ready to rotate for something new.

Questions? Leave a comment below!",2021-08-15T08:25:16-07:00,available
The sack Leather Bag,98.0,777.0,The sack Leather Bag new never used has a lot of compartment  good sturdy Bag will hold a lot thanks for looking,2021-09-21T21:57:49-07:00,available
Travelon Bag,49.0,777.0,Travelon belt are crossbody suede bag has lots of compartments new condition never used really great and lightweight for all of you essentials,2021-12-10T11:33:25-08:00,available
Original Paris Design wallet,20.0,777.0,Original Paris Design wallet it has a small coin purse in side of the other one,2021-08-26T22:30:58-07:00,available
Betsey Johnson shoulder bag,35.0,777.0,Betsey Johnson shoulder bag new condition never used has one zipper compartment big enough to hold your things really cute and lightweight,2021-08-15T10:38:38-07:00,available
galanya Bag,115.0,698.0,galanya Bag patten leather with sequence on the front plus gold hard wear and chain new never used the value of the bag is 698.00 has back zipper for phone plus 4 compartment on the inside this Bag is Beautiful the picture don’t do this bag justice,2020-10-23T14:06:58-07:00,available
Longaberger purce and wallet,95.0,777.0,Longaberger small purce with matching wallet really cute never used will hold the wallet and your other small items thanks for looking,2021-05-24T11:40:54-07:00,available
K .Jordan Dress,75.0,150.0,Beautiful all fringe all over the dress never worn got it for New Year’s Eve but was sick  and I no longer need it new .so sexy❤️,2020-03-01T10:57:56-08:00,available
"Herman,s Hermits tee",125.0,777.0,"Herman,s Hermits vintage tee shirt signed  good condition for being vintage this is a great collectors item this can be used for a man also thank you .😊",2022-12-28T22:08:09-08:00,available
BYLINE Blouse,58.0,777.0,BYLINE Blouse 👚 Beautiful Detail  very pretty  all the stones are there  great for the holidays,2020-12-17T11:50:13-08:00,available
Maurices shirt.,35.0,777.0,Really cute and new never worn😊,2022-09-30T16:47:48-07:00,available
Harley Davidson top,65.0,777.0,Hardly Davidson Top great condition vintage,2020-10-23T22:54:10-07:00,available
lululemon Braw,40.0,777.0,lululemon Braw  good used condition,2021-09-21T20:23:52-07:00,available
Jennifer Lopez  sweater,65.0,77.0,Jennifer Lopez Sweater beautiful new so shiny and soft,2020-10-24T22:50:36-07:00,available
Elvis Presley tee shirt,30.0,777.0,Elvis Presley tee good used condition good collectors idem no stains are rips .,2022-12-28T21:54:04-08:00,available
D K N  Y J E A  N S💋,35.0,0.0,DN K Y J E A N S BLOUSE New Condition really  comfortable to wear  has a lot of  Stritch👌,2020-07-10T09:06:59-07:00,available
Miss vintage shirt,60.0,777.0,Miss vintage long sleeve shirt new Condition thanks for looking ❤️,2020-09-07T13:44:35-07:00,available
Blouse,25.0,0.0,Beautiful design on this shirt 👚 I have never seen one like this ❤️,2020-03-01T13:36:02-08:00,available
Lily Dress,60.0,777.0,Beautiful crochet work and beautiful lace on this item never worn new condition you can wear with Leggins or pants💕,2020-03-29T11:27:47-07:00,available
Karen Kane Blouse,50.0,0.0,Beautiful Karen Kane dressy blouse lots of handwork on this beautiful blouse,2020-03-21T19:42:31-07:00,available
America Eagle 🦅 outfitters shirt,25.0,777.0,American Eagle 🦅 outfitters shirt great condition very lite Waite good for all year around.,2021-03-05T11:58:09-08:00,available
HARDLY DAVIDSON TEE,25.0,75.0,HARDLY DAVIDSON  TEE New Condition,2020-07-17T12:05:33-07:00,available
Jones New York Blouse,40.0,54.0,Jones New York Blouse new with tags it has a lot of stretch,2021-03-02T20:52:19-08:00,available
VINCE CAMUTO  BLOUSE,69.0,777.0,VINCE  CAMUTO BLOUSE NEW BEAUTIFUL,2020-07-15T12:23:25-07:00,available
Worthington blouse new condition never worn,35.0,777.0,Worthington  blouse which has never been used all my things are like  new condition thanks for looking🌹,2020-04-20T13:22:43-07:00,available
dress barn  blouse  really pretty 💕,45.0,0.0,This blouse has a beautiful design so comfortable you can wear it with a skirt or Levi’s nice for any time of the year,2020-03-21T19:23:04-07:00,available
LAETITIA ROSA SWEATER,25.0,0.0,LAETITIA ROSA SWEATER WITH STONS  On  THE FRONT OF THE SWEATER Very Contrable AND IT STRETCH ES,2020-12-17T11:42:00-08:00,available
Byline Blouse,75.0,777.0,Byline Blouse  the details in this  Blouse are Beautiful lots of color  with sequins and stones vantage that like new never worn the pictures don’t do the blouse justice,2020-11-09T12:58:44-08:00,available
HIPPIE LAUNDRY SHIRT,29.0,777.0,HIPPIE LAUNDRY NEW SHIRT NEVER USED   COLD SHOULDER VERY CONTRABLE 🌈🌈🌈🌈,2020-07-17T14:10:10-07:00,available
DownEast Blouse,35.0,777.0,DownEast Blouse lots of design pearls and sequence makes a Beautiful Boe great condition,2020-10-24T22:19:56-07:00,available
Nicole top,45.0,777.0,Nicole top new very contrable has spandex nice for the summer 🌈,2020-07-22T11:08:31-07:00,available
A  Z I Blouse,49.0,0.0,This blouse is so amazing all of the artwork on it all hand beaded beautiful and so comfortable,2020-03-22T17:37:56-07:00,available
Living DOLL Los Angeles shirt,65.0,175.0,Beautiful colorful beaded dressy blouse in new condition never worn very comfortable stretchy,2020-03-22T17:49:48-07:00,available
Kenneth Cole Blouse,39.0,125.0,Kenneth Cole Blouse sheer Excellent condition never worn really cute,2020-10-24T12:27:42-07:00,available
Body Contral Blouse,30.0,0.0,This Blouse is so comfortable it has a lot of stretch to it very Tracy in new condition only worn a few times just been hanging in my closet waiting for a new home❤️,2020-03-22T17:59:34-07:00,available
Parker tee shirt good used condition,10.0,0.0,Nice tee used condition but still nice,2020-04-09T15:15:17-07:00,available
aloiz Blouse,50.0,0.0,aloiz Blouse excellent condition very sheer and dainty see thrue really cute,2020-11-12T11:48:31-08:00,available
Dressbarn Blouse,65.0,777.0,Beautiful spring colors on this sheer comfortable blouse new condition it hasn’t been worn,2020-05-20T12:40:45-07:00,available
TEE SHIRT LOGO,35.0,75.0,LOGO TEE NEW Condition,2020-07-07T23:35:07-07:00,available
Carter Club sequin top Beautiful Condition ❤️,20.0,0.0,This top is really dressy or casual as very Comfortable,2020-03-21T19:12:39-07:00,available
Hippie ink tee shirt,30.0,0.0,Hippie ink Red with Beautiful Stones on its day its done in green and red and white stones,2020-03-06T20:23:19-08:00,available
Carolyn Taylor Sweeter,55.0,200.0,Carolyn Taylor Sweeter very soft you can wear this with are without the scarf has rhinestones very pretty,2020-10-23T22:28:10-07:00,available
Shine New York Blouse,15.0,0.0,Beautiful shiny  Blouse Great for summer wear great condition😊,2020-05-24T09:40:02-07:00,available
Massimo blouse good used condition beautiful color,25.0,0.0,Beautiful Massimo  Blouse in excellent condition very comfortable,2020-04-09T15:46:39-07:00,available
Louis Vuitton Sun Glasses,361.0,777.0,"Louis Vuitton Sun Glasses great shape no scratches on them the left side of the frame may need adjusted  because it is tighter then the right they are beautiful the style,I haven’t worn these  they were a gift 🎁 so I would like some one else to enjoy them ❤️",2023-02-22T22:38:34-08:00,sold_out
Victoria’s Secret pink strapless Braw,30.0,777.0,Victoria’s Secret pink strapless Braw new,2021-09-19T19:03:14-07:00,available
Utah  uts backpack  new,48.0,777.0,Utah uts backpack new never used medium size really nice and well-made,2021-11-18T11:14:04-08:00,available
Gucci Boots,475.0,777.0,Gucci Boots vintage Reconditioned I have had these boots gone over and stitched in different places these are very good boots the outside is very good excellent condition for there age  zippers work great  these boots have been cleaned and stitch you may need to put a zipper pull on them but other then that they are in good vintage condition thanks for looking.,2022-09-28T13:04:05-07:00,not_for_sale
RUBY Rd. BLOUSE,50.0,200.0,RUbY Rd.BLOUSE ARE LITE Jacket can be used either way very nice  and shiny great condition,2020-10-23T22:42:02-07:00,available
We The Free shirt,53.0,777.0,Free People Shirt Are Jacket only worn a fue times excellent condition has net closures  on the sleeves and front really cute,2020-11-09T12:05:03-08:00,available
Free People Blouse,45.0,777.0,Free People Blouse never worn excellent condition the back splits open beautiful detail,2021-02-25T14:37:36-08:00,available
BORSE N PELLE  PURCE,78.0,777.0,BORSE N PELLE PURCE good used condition great for every day crossbody  genuine leather   .,2022-08-05T22:29:22-07:00,not_for_sale
baggallini Bag,40.0,68.0,baggallini crossbody has lots of compartment and has security for your credit cards really super cute has beautiful shiny  strap brabd new pretty color,2021-12-10T12:57:29-08:00,sold_out
Anne Klein gloves,55.0,777.0,Beautiful Anne Klein gloves new Leather they are very comfortable to wear  Beautiful burgundy color,2021-11-25T11:29:43-08:00,available
Bebe Sun glasses case,20.0,777.0,Bebe Sun glasses case great shape  small size,2022-06-01T15:40:41-07:00,available
U k beanie and leather belt,80.0,777.0,U k Bennie and Leather Belt made by Robin Ruth new great for a Christmas gift are for yourself super nice this could also be for a woman too ❤️,2021-11-22T11:10:27-08:00,available
Seven 7 jeans,65.0,777.0,Seven  jeans 👖 never worn has  rhinestones on the pockets  and a big one for the button they are so cute and has stretch,2021-07-28T15:15:15-07:00,available
Pilcro jean,45.0,777.0,Pilcro  jeans slim Boyfriend cut like new Condition has Beautiful sequence pattern 28 petite really nice and pretty,2021-09-25T11:02:41-07:00,available
UGG Cross OVER  BAG,102.0,150.0,UGG cross over bag  new has tags  you can also use for a belt bag  comes with dust bag,2023-02-22T15:02:35-08:00,sold_out
Vintage silver ring Marked .925 with turquoise and zircon stones,127.0,777.0,This is a Beautiful turquoise ring all hand done I believe it’s about a 6/1/2  it has a zircon stone in the middle  it is made well,2023-03-02T07:16:10-08:00,sold_out
"Mercedes Benz NWOT Knit, Red, White Blue Cap",35.0,777.0,"Reposhing this item I purchased from @hollywoodheidi. Loved it, but ready to rotate for something new.

Questions? Leave a comment below I love ❤️ this hat but it does not fit my head  this hat is in excellent shape it’s very stretchy",2021-12-05T08:00:05-08:00,available
Miss me jeans,69.0,777.0,Miss me jeans new never worn nice sequin design they are so cute lots of detail cropped design,2021-09-25T11:47:46-07:00,available
RUBBER BAND STRETCH JEANS,65.0,777.0,Rubber Band stretch jeans new never used Beautiful Color,2021-04-07T18:48:59-07:00,available
G-star Denim jeans,65.0,777.0,G-star Raw Dinim jeans Excellent used condition like new,2021-10-03T12:41:42-07:00,available
L.A. IDOL jeans,25.0,777.0,LA Idol Jeans used condition I pointed out the bottom of the legs have were but they still have a lot of life left all the stones and studs are there,2021-04-08T16:30:24-07:00,available
Felina Lingerie,35.0,0.0,Nice and sexy girdle  fits very comfortable very stretchy has spandex and a garter belt never worn but really nice,2020-05-24T09:55:11-07:00,available
Frye Leather Boots,76.0,777.0,Frye Leather Boots great shape just put new heels on them  they will give you a long time of service  really been taking good care of  👍,2023-02-22T08:49:15-08:00,sold_out
Tiffany & co.Bracelet,220.0,777.0,Tiffany & co Bracelet vintage good used condition 925 sterling silver   Very comfortable 👍😊,2023-02-12T13:02:55-08:00,sold_out
Victoria secret Braw,22.0,777.0,Victoria  secret push up Braw used a fue times great shape will come  freshly cleaned 🧼 up .,2023-02-06T11:14:58-08:00,available
David Yurman crossover ring big and bold😊,300.0,777.0,"Reposhing this item I purchased from @chelseymcaleer. Loved it, but ready to rotate for something new.

Questions? Leave a comment below this ring is a  bold heavy ring and could use a polishing  thank you 😊",2022-08-25T17:42:57-07:00,sold_out
Purse,10.0,0.0,Beautiful big hand bag with lots of pockets in the inside and one on the outside good condition.,2020-03-01T16:33:28-08:00,sold_out
FreeBird  Boots,130.0,777.0,FreeBird leather Boots only worn a fue times very contrable and really cute you can dress up or down with this pair of Boots  I love the Buckle  😊,2023-01-07T18:55:43-08:00,sold_out
Gucci Boots,250.0,777.0,Gucci  leather boots very good condition they have been used but still a very nice the inside is like new the outside has a few scuffs on the hills and the swade does collect lint zippers work great these  Boots run small  and they are narrow  I would say more like a seven  great looking on thanks for looking.,2022-09-26T12:09:35-07:00,sold_out
Miss chick shorts,28.0,777.0,Miss chick shorts good used condition they stretch,2021-04-28T13:49:43-07:00,sold_out
Christian Dior vintage necklace,145.0,777.0,Christian Dior vintage gold plated necklace like new condition that is 18 inches long adjustable class beautiful piece has pearl and white stones which I don’t Know what they are  really sparkle 💖,2022-06-02T11:28:00-07:00,sold_out
