Title_Item,Price,Original Price,description,time_of_published,status
Danielle Nicole Bag,35.0,777.0,Danielle Nicole  Bag  trimmed in leather  snap closure small bag has three spots for credit cards  really cute can be worn as a crossbody bag are handle,2021-10-07T21:21:55-07:00,available
Diamond tennis Bracelet,4890.0,8000.0,Diamond tennis Bracelet authentic beautiful it ways 12.5 grams  and the Kt wait is 3kt   In 14 Kt white Gold  the Diamonds are  good quality grade it’s so sparkly anyone would love to sport this really a eye c catcher  it’s missing the little chain we’re the clasp is but that doesn’t affect the hook it’s very good  thanks for looking it was really hard to get the picture of the Kt  but it’s there.⭐️⭐️⭐️⭐️⭐️,2023-02-12T14:27:33-08:00,available
Vintage Lion 14k Gold Ring 11.7 grams of gold,1900.0,777.0,"Beautiful 14k gold, vintage lion ring. Lots of detail. Has ruby eyes and a Diamond in the mouth. 
Heavy gold, 11.7 grams of gold price is firm 😊 Thank you.",2022-05-05T08:41:03-07:00,available
Burberry sunglasses,225.0,777.0,Burberry sunglasses only used a fue times no scratches comes with box and case  excellent used condition very nice,2021-04-25T14:57:05-07:00,available
Fendi sunglasses,145.0,777.0,Fendi Sunglasses used but no scratches in good condition comes with case and cloth  nice looking,2021-04-25T14:44:19-07:00,available
VERSACE SUN GLASSES 🤓,325.0,777.0,VERSACE SUN GLASSES BEAUTIFUL 😍 PERFECT CONDITIONS  BROWN LITE  BROWN WITH GOLD TRIM   🔥💥,2022-06-01T15:34:26-07:00,available
Versace sunglasses,325.0,777.0,Versace sunglasses new comes with case and card beautiful never worn  really nice looking,2021-04-25T14:32:52-07:00,available
INVICTA MICKEY MOUSE WATCH,250.0,777.0,INVICTA Mickey Mouse watch new has batterie and  crystal stones around the face really cute. Great time peace  a watch that you can wear all the time stainless steal,2023-03-11T11:06:30-08:00,available
Versus Versace watch,450.0,777.0,Versace Swarovski crystal watch new never used Beautiful comes with Box and papers  it’s really a eye catcher never used so will need a Battery gorgeous,2022-02-13T10:44:40-08:00,available
VERSACE WATCH,299.0,777.0,VERSACE STAINLESS STEEL VINTAGE WATCH EXCELLENT CONDITION NO   SCRATCH MARKS   ITS COMES FROM THE  70 ARE 80  ERA GOOD RUNNING CONDITION  BEAUTIFUL ❤️,2021-10-12T21:13:51-07:00,available
Beautiful Diamond Wedding Set,6300.0,7300.0,Diamond Wedding Set White Gold  please look at appraisal thank you so much this is a very very gorgeous ring the diamonds in this  ring are excellent Quality thanks for looking,2022-04-27T17:32:37-07:00,available
Diamond cocktail Ring,5495.0,777.0,"Beautiful Diamond cocktail Ring  5 Kt  Diamonds Heavy Gold marquis  cut emerald catch round, cuts one-of-a-kind will post more information soon 33 grams of gold super rare .",2023-04-30T11:58:31-07:00,available
David yuman Diamond Bracelet,850.0,777.0,David yuman silver Crossover Bracelet 25 Diamonds ♦️ Beautiful 😻  I have another one that I have listed I used to wear them together   This one stands out so pretty excellent condition like new .♦️28 grams of silver  and 18 Kt gold ❤️ Beautiful gift for  any time of the year❤️,2022-01-21T23:49:31-08:00,available
Gucci Watch price i negotiable😊,400.0,777.0,Gucci Watch older style works great  has some minor scratches on the Back due to age keeps really good time  don’t have the Box but will send nicely packed  thanks for looking 😊,2022-03-07T22:27:29-08:00,available
Gucci watch,425.0,777.0,Gucci watch good used condition has Battery works great  with fit a 7 inc wrist good fold over clasp really pretty  has a fue scuffs on it but works great .,2023-02-12T12:38:43-08:00,available
T&C  Bangle Bracelet,525.0,777.0,T&C BANGLE BRACLET  14 KT GOLD AND 925 Sterling SILVER BEAUTIFUL DETAIL  ALMOST A FULL KT OF DIAMONDS  CHUNKY BRACELET  47 GRAMS OF SILVER NEW CONDITION A MAN OR A WOMAN COULD WEAR THIS  GREAT FOR That SPECIAL SOMEONE ❤️💕,2022-01-26T00:12:23-08:00,available
Tiffany and Company watch,465.0,777.0,Tiffany and Company watch great condition works fine. Will come with a new battery. No scratches authentic. Thanks for looking.,2023-04-23T23:04:38-07:00,available
Ladies 18K Yellow Gold & Stainless Steel Rolex with .70ct Diamond Bezel ( SALE,8550.0,10200.0,Refer to the appraisal for watch details ON SALE😊,2022-07-12T18:55:20-07:00,available
Capricorn shorts daytrip,35.0,777.0,"Capricorn shorts nice used condition 
They have stretch and are really cute",2021-07-12T12:54:33-07:00,available
BcRock for Express,65.0,777.0,Express Jeans never worn they have some stretch they are really nice like new,2021-08-29T15:26:32-07:00,available
Amethyst shorts,25.0,777.0,Amethyst shorts  above the knee good used condition on rips the stones are there none missing cute and they stretch,2021-04-11T12:14:35-07:00,available
Sneak peek shorts,49.0,777.0,Sneak peek shorts new high waist they are really nice and soft,2021-04-28T14:44:37-07:00,available
Y2K juicy couture jacket,75.0,777.0,"Reposhing this item I purchased from @papermountains. Loved it, but ready to rotate for something new.

Questions? Leave a comment below!",2021-12-15T18:27:25-08:00,available
Anna cole 2piece set,49.0,92.0,Anne cole 2piece swin set new with tags really cute and has a lot of stretch,2021-05-28T13:58:31-07:00,available
"H,M COLLECTION SHORTS",35.0,777.0,"H,M COLLECTION SHORTS 🩳 NEW NEVER WORN REALLY A Pretty Color they have some stretch cute",2022-04-07T12:01:24-07:00,available
Signature shorts,45.0,777.0,Signature shorts new with tags never been worn really nice pair of shorts and extra bottom,2021-04-28T14:13:42-07:00,not_for_sale
Tractor  Shorts,20.0,0.0,Tractor Shorts new  I don’t know if these are for a child Are adult they look small for a 8 In adult but they have some stretch .,2021-07-12T12:38:14-07:00,available
L.A. IDOL shorts,45.0,777.0,LA IDOL Shorts,2021-07-12T12:45:55-07:00,available
Cat & Jack shorts,38.0,777.0,Cat &Jack Jeans Shorts new Condition I think they are for a child are a adult extra small,2021-04-05T19:53:24-07:00,available
Zco Jeans,30.0,78.0,Zco Jeans shorts nice used condition no missing stones zipper works really cute,2021-04-02T18:07:29-07:00,available
L. .A .IDOL SHORTS,20.0,75.0,L .A   IDOL ABOVE THE  KNEE SHORTS GOOD USED CONDITION NO  MISSING STONES   NO RIPS,2021-04-02T09:16:05-07:00,available
BullHEAD Shorts,30.0,777.0,BULLHEAD SHORTS LOW RISE GOOD USED CONDITION  THEY Don’t have stretch  so might not be true to size  but they are small,2021-04-14T12:00:30-07:00,available
American Bazi Jeans shorts,35.0,777.0,American Bazi shorts  new condition super cute they stretch,2021-04-07T10:25:52-07:00,available
VANILLA STAR ⭐️ SHORTS,20.0,777.0,VANILLA STAR ⭐️ SHORTS GOOD USED CONDITION,2021-06-25T14:11:07-07:00,available
SHORT  SHORTS,20.0,55.0,SHORT SHORTS  REALLY CUTE HAS STUDS GOOD USED CONDITION,2021-03-26T16:54:34-07:00,available
Arita Jeans shorts,30.0,777.0,Arita Jeans shorts good used condition stretch and contrable really cute,2021-04-05T19:34:09-07:00,available
Sound / Style Shorts,45.0,777.0,Sound / style shorts new with out tags nice pair of shorts,2021-08-24T21:37:28-07:00,available
VANITY COLLECTION SHORTS,25.0,777.0,VANITY COLLECTION SHORTS GOOD  USED CONDITION,2021-06-25T14:05:52-07:00,available
reign shorts,35.0,75.0,reign shorts only used a fue times they have rhinestones on the front of the shorts and they have stretch,2021-04-28T13:36:44-07:00,available
rebel & soul shorts,45.0,125.0,rebel& soul shorts nice condition only worn a fue times really cute no missing studs are stones great shape,2021-04-02T18:17:29-07:00,available
ReWash Brand,38.0,777.0,ReWash Brand New York Los AngLes new Condition nice pair of shorts very lite Waite,2021-06-16T15:12:55-07:00,available
reign shorts,30.0,777.0,reign shorts  nice used condition,2021-06-16T15:20:03-07:00,available
Big 🌟 Star shorts,36.0,777.0,Big Star shorts nice used condition great shape,2022-04-07T12:22:19-07:00,available
SHYANNE JEANS,75.0,777.0,SHYANNE JEANS really cute never worn lots of detail Rhinestones and really pretty artwork,2021-10-03T12:55:12-07:00,available
Rock wrangler shorts,55.0,777.0,Rock Wrangler  Shorts new never worn  I can’t find a size but I guess it says a 4 -7  so maybe that’s the size but they have some stretch  and are really cute,2021-06-16T15:05:57-07:00,available
IRIS basic shorts shortie,35.0,777.0,Iris basic Shorts good used Condition it’s says midsize but I would say they will fit a small they have stretch and are really cute,2021-04-14T12:33:29-07:00,available
Salt Works Shorts,55.0,777.0,Salt Works Shorts  Never Been Worn New Condition they have stretch  really a nice pair of shorts  and made really good,2021-07-05T10:47:52-07:00,available
Massimo high Rise Shorts,36.0,777.0,Massimo high-rise shorts good used condition very cute and very comfortable  no rips no tears,2021-04-22T11:36:46-07:00,available
P. S. Erin was son   Shorts,35.0,777.0,P.s. Erinwasson shorts  never worn new condition very cute,2021-04-28T14:38:48-07:00,available
Mid Saturday jeans shorts,38.0,777.0,Mid Saturday jeans shorts new condition very cute,2021-04-05T19:58:24-07:00,available
RSQ Jeans Shorts,35.0,777.0,RSQ Jeans Shorts New never worn really nice And have stretch Hampton midi,2021-04-29T14:48:37-07:00,available
Zcojeans  shorts,35.0,75.0,Zcojeans shorts new,2021-03-17T12:50:14-07:00,available
rue 21 shorts,23.0,777.0,rue  21 shorts good used condition very contrable they stretch  😊,2022-04-08T17:34:05-07:00,available
MOSSIMO SHORTS,25.0,777.0,MOSSIMO SHORTS GREAT Shape really cute has stretch used condition but looks new high Rise,2021-05-19T13:12:53-07:00,available
Umgee shorts,48.0,777.0,Umgee shorts new still have tags on high waist Button up have stretch really nice,2021-04-28T14:30:01-07:00,available
Y m I shorts,30.0,777.0,Y m I shorts good used condition no flaws super cute 🥰 four pockets nice zipper ❤️,2022-05-18T13:42:32-07:00,available
Silver shorts,35.0,777.0,Silver shorts  great used condition  still have a lot of life left,2021-04-28T14:05:28-07:00,available
Wax Jeans,40.0,777.0,Wax jeans new never worn great pair of shorts very nice looking on has stretch,2021-04-22T11:46:41-07:00,available
Pink victory secret shorts,45.0,777.0,Pink victory secret shorts new never worn really nice,2021-04-14T12:41:43-07:00,available
Hollister short short shorts,22.0,777.0,Hollister short short shorts great used condition they stretch,2021-04-14T16:02:31-07:00,available
Hydraulic shorts,30.0,95.0,Hydraulic shorts great used shape they have stretch all the stones are there zipper works has four pockets,2021-04-02T17:58:31-07:00,available
A p Blue shorts,35.0,75.0,A p Blue Jeans shorts good used condition really cute these shorts will fit midsize they have some stretch  but look really small to me I think even a small it all depends on how you like to wear them 💐,2021-04-22T11:28:44-07:00,available
Life in progress shorts,45.0,777.0,Life in progress Shorts new  never worn they have four pockets in the front two on the sides and two front ones  and they have stretch  very well made,2021-09-04T13:51:30-07:00,available
Roxy Shorts,35.0,777.0,Roxy Shorts New,2021-08-29T14:12:07-07:00,available
Zella shorts athletic wear,35.0,777.0,Zella shorts athletic wear really cute only used once new condition,2021-03-17T12:23:55-07:00,available
JONES  OF NEW YORK SHORTS,33.0,777.0,Jones New York shorts like new condition  has to deep pockets  in the front  and stretch really cute 🥰,2022-05-31T11:53:04-07:00,available
Signature shorts,30.0,777.0,Signature shorts in good used condition a fue of the buttons have some scratches on them but other then that  really good shape,2021-04-15T13:43:16-07:00,available
VIP JEANS Shorts,30.0,777.0,VIP jeans shorts new never worn really cute 🥰,2022-07-29T16:14:50-07:00,available
Massimo boyfriend shorts,30.0,777.0,Massimo boy friend short very good used condition like new thanks for looking,2021-07-12T11:40:13-07:00,available
Pacsun shorts,30.0,777.0,Pacsun super stretch shortie shorts nice used condition really contrable .,2022-05-18T13:08:17-07:00,available
daytrip shorts,25.0,777.0,daytrip shorts nice used condition they stretch,2021-08-18T22:42:33-07:00,available
daytrip Shorts,30.0,777.0,daytrip Shorts good used condition really cute  there is nothing wrong with them   They have stretch,2022-04-07T12:15:29-07:00,available
Litz shorts,31.0,777.0,Litz shorts new nice pair of shorts,2021-04-29T14:42:11-07:00,available
Calvin Klein performance pants,30.0,75.0,Calvin Klein performance Athletic pants great shape,2021-03-02T21:44:04-08:00,available
Aeropostale shorts,26.0,777.0,Aeropostale shorts shorts good used  condition very cute,2021-04-28T14:53:08-07:00,available
BU.LL HEAD SHORTS,30.0,85.0,BU. LL HEAD SHORTS GREAT USED CONDITION TRUE TO SIZE REALLY CUTE .,2021-07-12T11:47:09-07:00,available
Free People shorts,38.0,777.0,Free People shorts good used condition,2021-06-02T12:38:11-07:00,available
Massimo  denim short short shorts,50.0,777.0,Massimo denim short short shorts  high Rise really good used condition great for summer,2021-04-15T13:56:34-07:00,available
MISS ME  SHORTS,60.0,777.0,MISS ME SHORTS REALLY GOOD CONDITION HAS ALL THE STONES NO RIPS    REALLY CUTE,2021-03-26T16:25:12-07:00,available
Levis Strauss &co,40.0,777.0,Levis Strauss  jeans shorts new condition,2021-04-05T19:44:34-07:00,available
MISS ME  MID-SHORT SHORTS,65.0,777.0,MISS ME MID-SHORT JEANS NEW NEVER WORN REALLY CUTE 🤗,2021-09-11T20:34:57-07:00,available
SHEIN SHORTS,25.0,777.0,SHEIN SHORTS  GOOD USED CONDITION TRUE TO SIZE,2021-06-16T15:33:00-07:00,available
American rag shorts,27.0,777.0,American  Rag shorts excellent used condition they have stretch and are very comfortable.,2021-10-03T13:04:32-07:00,available
American Eagle shortie,25.0,777.0,American Eagle shorts hi -Rise nice used condition  so cute,2021-08-11T23:44:24-07:00,available
American Eagle  🦅 shorts shorts,25.0,65.0,American Eagle shorts used condition really small I would say small to 0,2021-04-28T14:22:20-07:00,available
America Eagle 🦅 outfitters shorts,48.0,777.0,America Eagle Hi Rise shortie  super stretch good condition very cute,2021-03-24T14:07:33-07:00,available
Levi Strauss & co shorts 🩳,35.0,777.0,Levi Strauss Shorts new never used has some stretch,2022-06-14T10:40:09-07:00,available
American Eagle  shorts,38.0,777.0,American Eagle shorts new condition very cute and contrable nice design,2021-04-28T13:42:44-07:00,available
H & M Divided shorts,35.0,777.0,H & M Shorts Super Cute 🥰 true to size,2022-06-14T12:16:58-07:00,available
Guess shorts,27.0,777.0,Guess shorts really cute in great condition they have some stretch,2022-05-18T14:09:02-07:00,available
One x one teaspoon  shorts,30.0,777.0,One teaspoon shorts good used condition they stretch and are contrable price is firm thanks,2022-05-18T13:18:06-07:00,available
Zella Athletic shorts,40.0,75.0,Zella Athletic shorts new condition,2021-03-17T14:32:34-07:00,available
Van Heusen shorts with skirt Athletic wear new,55.0,64.0,Van Heusen Athletic wear shorts with Skirt new,2021-03-17T12:17:13-07:00,available
Zella shorts Athletic,39.0,777.0,Zella Athletic shorts great condition,2021-03-17T14:39:23-07:00,available
L. A. IDOL SHORTS reserved,35.0,777.0,L. .A  lDOL SHORTS Good used condition really cute  low rise,2021-04-14T12:15:43-07:00,available
Pink victory secret shorts,45.0,777.0,Pink victory secret shorts new condition very cute they stretch and are made really good,2021-04-14T12:48:41-07:00,available
Maison Jules shorts,35.0,777.0,Maison Jules shorts never used new with out tags really cute nice detail,2022-05-18T12:58:45-07:00,available
Celebrity pink original denim,25.0,777.0,Celebrity pink original denim shorts new condition they have never been worn very cute and they have stretch,2022-06-14T11:07:52-07:00,available
Body shaper,65.0,125.0,Body shaper new never used got it from Monroe and main but never used,2021-01-21T12:56:38-08:00,available
EXPRESS  SHORTIE SHORTS,45.0,777.0,EXPRESS SHORTS   ONLY WORN Once NEW Condition  REALLY Cute THEY ARE really Contrable And They Stretch  .,2022-05-11T15:35:36-07:00,available
Miss me jeans,40.0,777.0,Miss me jeans  Denim Brand   Used but in great shape all the studs and stones are there really cute 🥰,2021-12-06T20:41:08-08:00,available
American Eagle 🦅 outfitters shorts,48.0,777.0,American Eagle 🦅 outfitters shorts great used condition really nice and cute great for spring and summer,2021-04-14T16:29:58-07:00,available
Ten Gear skort,45.0,777.0,Ten Gear Athletic shorts new condition never worn,2021-03-17T14:27:46-07:00,available
"San,s souci Sequin shorts",40.0,777.0,"San,s Souci sequined shorts good used condition really cute they stretch and zippers are just for looks thanks for looking",2021-05-19T13:44:02-07:00,available
Anthropologie pants,65.0,777.0,Anthropologie pants never used great shape and cute they stretch has zipper on the side very nice for summer 🥰,2022-05-18T14:24:08-07:00,available
Wrangler Jeans,75.0,777.0,Wrangler Jeans  new never worn they are true to size no stretch high waisted really different design  they have some  smudges from the design on some parts of the jeans I don’t know if that’s the way they designed them or not  but really different and way cute 🥰,2023-02-26T11:35:59-08:00,available
Rock Revival Jeans,69.0,777.0,Rock Revival jeans new  comes with extra Button Ashley skinny  still has sticker on the jeans 👖,2021-06-16T15:47:04-07:00,available
CAT & JACK SHORTS,30.0,777.0,CAT & JACK SHORTS SUPER STRETCH GOOD USED CONDITION REALLY CUTE,2021-06-25T14:18:53-07:00,available
Express Shorts,55.0,777.0,Express Shorts new never worn has two pockets in the back and two in the front zipper on the side .,2021-05-28T13:16:17-07:00,available
PARA SHORTS,55.0,777.0,PARA SHORTS NEW NEVER WORN HAS A LOT OF STRETCH,2021-06-16T15:26:25-07:00,available
Michael Kors shorts,55.0,89.0,Michael Kors shorts brand new never been used they have stretch and they are very comfortable thanks for your interest,2022-06-14T10:48:21-07:00,available
Zella pants,60.0,777.0,Zella pants new never used really nice and have the legs on the side cut out great for summer 🥰,2023-04-20T08:22:21-07:00,available
Free People shorts,30.0,777.0,Free People shorts great used condition true to size,2022-04-07T12:07:27-07:00,available
Rag &Bone Shorts,65.0,777.0,Rag & Bone Shorts never Used,2021-03-24T14:14:13-07:00,available
One x one teaspoon shorts,35.0,777.0,One x one teaspoon shorts good used condition really cute 🥰,2022-06-14T11:51:00-07:00,available
Fry  Leather Belt Bag  good used condition,145.0,777.0,Fry Leather Belt Bag good used condition great for your small necessities only used a fue times .the belt measure 46 inc the bag is 8inc in witch  51/2 long  great Bag,2021-06-07T10:50:03-07:00,available
HUDSON JEANS,27.0,777.0,Hudson jeans good used condition  I think these jeans are for a teenager they say twelve but look like they are for a petite person or someone  small they stretch  they are 33 inc long and about 14 inc across really 🥰,2021-08-29T15:39:36-07:00,available
MICHAEL KORS BAG,30.0,777.0,Michael kors small leather Bag 9inc across/6 inc deep  small Handel nice used condition great for your phone and wallet  it’s cute,2021-04-08T16:08:59-07:00,sold_out
Mickey Mouse 🐭 watch,75.0,777.0,Mickey 🐭 watch vintage works great new battery has some faded on the claps great for it age has adjustable clasp Seiko Walt Disney protection also has some scratches on the back   And around the face of the watch but none on the face 🐭,2022-05-19T21:59:23-07:00,available
Louis Vuitton wallet,499.0,777.0,Louis Vuitton vintage wallet in great used condition has a few scuffs. The zipper works great has a lot of compartments. The canvas is really clean. For its age  7/12 wide about 4/12 long snap works great Date code  CA6008 .I pointed out in the last picture the two small areas that were  damaged  . And the rest are scutt marks   .,2023-03-25T13:06:01-07:00,available
AUTHENTIC Chanel Essential Bowler Bag Leather,1900.0,2395.0,"Reposhing this item I purchased from @medusa8383. Loved it, but ready to rotate for something new.

Questions? Leave a comment below!I have never used this bag there is nothing wrong with it it’s beautiful  I would like to find it a new home  so some one else can enjoy it",2021-08-23T00:30:45-07:00,available
Charles Winston’s moisanite fire Ring PRICE IS FIRM,499.0,777.0,Moissanite ring designed by Charles Winston 3.66 carats beautiful ring the gram on it is 4.32 rhodium over silver very beautiful and has a lot of spark light more beautiful than a diamond if you want to be the center of attention this would be the ring for you it’s so beautiful😎 great for a valentines gift❤️🌹🥰,2021-08-22T12:43:14-07:00,available
Louis Vuitton  Bag,1890.0,777.0,Louis Vuitton shoulder  Bag vintage new condition only used a fue times this Bag is rare it’s Beautiful in side and out and the strap is the original one that goes to it it comes with dust bag 💼 the person that buys this will love it  date code RS9206  lots of compartment on the in side  and one on the outside very rare find snap closure on the flap  ❤️ the leather on this Bag is really soft  and the inside i is suede.,2023-03-29T14:17:17-07:00,available
DIAMOND AND GOLD RING 💍SOLD),1450.0,777.0,Beautiful 18 Kt Gold Diamond Ring almost a half Kt Ot Beautiful Diamonds And Gram Weight is Almost Ten Grams  It’s Very Beautiful 😻,2022-07-11T14:37:20-07:00,available
Napier  Beeds Vintage Necklace,75.0,777.0,Napier vintage beeds necklace great shape Beautiful 😻 about  15/ and one half inc  long really shiny 🔥,2022-06-14T12:50:29-07:00,available
Tennis Bracelet  silver,98.0,777.0,"Reposhing this item I purchased from @vintageness. Loved it, but ready to rotate for something new.

Questions? Leave a comment below! This Bracelet is really nice the stones are cubic zirconia and they shine really pretty but unfortunately it does not fit me  it is  about 7 inches long and the bracelet is very comfortable  thanks for looking 👀",2023-04-14T08:37:24-07:00,available
Marquise cut Diamond ring,1400.0,777.0,Marquise cut diamond ring with the middle stone over a quarter Kt  10 smaller Diamonds ♦️ the Qualityi is excellent set in 14 Kt gold  the pictures does not do the ring justice  nice wide band great for a wedding ring are for any other occasions .,2021-06-14T13:58:37-07:00,available
Turquoise and  silver coil men’s ring,449.0,777.0,Vintage turquoise and silver with Coyle heavy men’s ring  this ring was hand made and very old it has a mark on the back witch I can’t understand it but this is really unique thanks for looking 👀,2023-04-20T11:59:56-07:00,available
Diamond cocktail Ring,358.0,777.0,Diamond cocktail ring Beautiful 1 ct of genuine diamonds set in Beautiful sterling silver these pictures does not do this ring Justus  it’s really pretty  brand new just tryed on .,2022-01-16T08:24:57-08:00,available
GUCCI CHARM,58.0,777.0,"Reposhing this item I purchased from @eddylids17. Loved it, but ready to rotate for something new.

Questions? Leave a comment below!",2022-05-09T16:16:00-07:00,available
Jade and Diamond Ring 18 Kt white gold,3100.0,8000.0,This is a do you designers ring one of a kind the jade in the middle spins around and the Diamond on the side are beautiful and excellent ❤️comes with appraisal you will never find another one like this 💕,2020-03-12T12:57:08-07:00,available
Tanzanite and diamond ring,3800.0,4200.0,Tanzanite and diamond dinner ring beautiful everything is in the appraisal thanks for looking.❤️😊,2022-10-14T20:07:40-07:00,available
Coach Bag,199.0,777.0,Coach Leather Bag New Condition only used a fue times has a Beautiful Silver shine to the strap  and the Coach carriage on the flap really nice 👌👍,2020-07-29T15:26:42-07:00,available
Ted Baker Wallet,345.0,777.0,Beautiful te Ted Baker Wallet new never used has Beautiful crystal Closure on the wallet lots of compartments place for your money coins and cards really different has lots of details on the inside Just Beautiful 🤩 ❤️,2023-05-24T22:07:52-07:00,available
Ted Baker wallet on a chain,148.0,777.0,Ted Baker wallet on a chain great condition has 10 card slots and zipper for change can fit a smaller phone  has lots of room you will love this snap works great and zipper the chain is original,2022-12-02T12:18:27-08:00,available
Gladiators,98.0,777.0,Gladiators sandals good used condition only worn once  these Gladiators are Beautiful they are spade Leather with studs detail and feathers very stunning 😍,2021-08-15T14:37:45-07:00,available
Donald j PLiner  SANDLES,140.0,777.0,Donald j PLINER SANDLES l Like New Condition   Really cute and contrable,2021-08-18T18:18:40-07:00,available
Gucci swade Leather Boots.,298.0,777.0,Gucci swade Leather Boots in good used condition I just had the heal touched up on the right one  it’s hardly noticeable but I wanted to point that out  please look over the pictures closely before buying them  the inside is like new  and they are narrow  so please take all of this in consideration thank you for looking  these Boots run small more like a seven    Allow it says eight.,2023-03-16T12:17:10-07:00,available
KEDS  for KATE Spade,65.0,777.0,KEDS For Kate Spade  Shoes new great looking.,2023-03-23T08:07:40-07:00,available
Clarks. Sandels,78.0,777.0,Clarks. Leather sandals new never worn really have great support and are contrable and great quality .,2023-03-08T11:25:58-08:00,available
VINCE CAMUTO SANDLES,78.0,777.0,Vince camuto SANDELS  new never worn Beautiful color  great for spring and summer 😍,2023-04-26T11:35:20-07:00,available
